{
  "schema_version": "1.0",
  "attempt_id": "ega_01J00000000000000000000004",
  "project_ref": "expflow:example-project",
  "operation_family": "project.sync",
  "idempotency_key": "guerilla-intent-00042",
  "request_digest": "sha256:dddddddddddddddddddddddddddddddddddddddddddddddddddddddddddddddd",
  "request_canonicalization_profile": "expflow-guerilla-jcs-v1",
  "expected_adapter_revision": "epr_01J00000000000000000000001",
  "actor": {
    "kind": "integration",
    "name": "guerilla-adapter",
    "version": "1.0"
  },
  "started_at": "2026-07-15T15:01:00Z",
  "core_operation_ref": "efo_01J00000000000000000000003"
}
